identifier,text
urn:cts:latinLit:phi0448.phi001.perseus-lat1:2.32.2,ille ante ineo ut intellego sum consilium qui deditio facio noster praesidium deduco aut denique in-diligo servo credo pars cum is qui retineo et celo arma pars scutum ex cortex facio aut vimen intexo qui subito ut tempus exiguitas postulo pellis induco tertio vigilia qui parvus arduus ad noster munitio accenseo video omnis copia repo ex oppidum eruptio facio
urn:cts:latinLit:phi0448.phi001.perseus-lat1:3.4.1,brevi spatium interjectus vix ut is res qui constituo con-loco atque administro tempus do hostis ex omnis pars signum do decurro lapis gaesum in vallus co-jacio
urn:cts:latinLit:phi0448.phi001.perseus-lat1:3.6.4,qui proelium facio qui saepis fortuna tento galba nolo atque alius sui in hibernum consilium venio memini alius occurro res video magnus frumentum commeatus inopia permoveo posterus dies omnis is vinco aedificium incense in provincia reverto contendo
urn:cts:latinLit:phi0448.phi001.perseus-lat1:3.14.3,neque satis brutus qui classis praesum vel tribunus miles centurio qui singulus navis sum attribuo consto quis ago aut qui ratio pugna insisto
urn:cts:latinLit:phi0448.phi001.perseus-lat1:4.1.8,neque multus frumentum sed magnus pars lacteo atque pecus vivo multus sum in venatio
urn:cts:latinLit:phi0448.phi001.perseus-lat1:4.34.2,qui facio ad lacesso hostis et committo proelium alienum sum tempus arbitror suus sui locus contineo et brevi tempus intermissus in castra legio reduco
urn:cts:latinLit:phi0448.phi001.perseus-lat1:7.81.2,subito clamor tollo qui significatio qui in oppidum obsideo de suus adventus cognosco possum cratis proicio fundus sagitta lapis noster de vallus proturbo reliquus qui ad oppugnatio pertineo paro administro
